{
  "version": 2,
  "artifact_sha256": "e58ebc264de3681789d6fd7774bf3ab1d396b091e0bb4fff6793566ec00d9a8b",
  "commitment_profile_id": "verifiable-telemetry-canonical-cbor-v2",
  "disclosure_class": "A",
  "verification_scope": "public_recompute",
  "channels": {"tsa": {"check": "tsa_verification", "status": "verified"}},
  "verifier_policy_id": "verifiable-telemetry-baseline-v2",
  "checks_executed": [
    "bundle_disclosure_validation",
    "verification_manifest_validation",
    "segment_artifact_validation",
    "segment_chain_validation",
    "record_level_recompute",
    "batch_metadata_validation",
    "segment_digest_binding",
    "tsa_verification"
  ],
  "checks_skipped": [],
  "overall": "success"
}
