{
  "version": 2,
  "artifact_sha256": "ce76302d1fcbf713097c0d70070b6a651bcd97e7855213aaf422b0ff9226708c",
  "commitment_profile_id": "verifiable-telemetry-canonical-cbor-v2",
  "disclosure_class": "C",
  "verification_scope": "anchor_only",
  "channels": {"tsa": {"check": "tsa_verification", "status": "verified"}},
  "verifier_policy_id": "verifiable-telemetry-baseline-v2",
  "checks_executed": [
    "bundle_disclosure_validation",
    "verification_manifest_validation",
    "segment_artifact_validation",
    "segment_chain_validation",
    "segment_digest_binding",
    "tsa_verification"
  ],
  "checks_skipped": [
    {"check": "record_level_recompute", "reason": "disclosure_class_c"},
    {"check": "batch_metadata_validation", "reason": "out_of_scope"}
  ],
  "overall": "success"
}
